{
  "$schema": "https://json-schema.org/draft/2020-12/schema",
  "$id": "https://muxui.dev/schema/component.schema.json",
  "title": "Mux UI component concept",
  "type": "object",
  "additionalProperties": false,
  "required": ["schemaVersion", "id", "kind", "name", "summary", "lifecycle", "intent", "anatomy", "states", "accessibility", "bindings"],
  "properties": {
    "schemaVersion": {
      "const": "1.0.0",
      "x-muxui-authoring": { "effect": "incompatible", "revisionAxes": ["content"] }
    },
    "id": {
      "type": "string",
      "pattern": "^muxui:component:[a-z0-9]+(?:-[a-z0-9]+)*$",
      "x-muxui-authoring": { "effect": "incompatible", "revisionAxes": ["content", "binding-spec"] }
    },
    "kind": {
      "const": "component",
      "x-muxui-authoring": { "effect": "incompatible", "revisionAxes": ["content"] }
    },
    "name": {
      "type": "string",
      "minLength": 1,
      "x-muxui-authoring": { "effect": "editorial", "revisionAxes": ["content"], "autofixes": ["trim-outer-whitespace"] }
    },
    "summary": {
      "type": "string",
      "minLength": 1,
      "x-muxui-authoring": { "effect": "editorial", "revisionAxes": ["content"], "autofixes": ["trim-outer-whitespace"] }
    },
    "lifecycle": {
      "enum": ["experimental", "stable", "deprecated", "removed"],
      "x-muxui-authoring": { "effect": "incompatible", "revisionAxes": ["content", "binding-spec"] }
    },
    "intent": {
      "type": "object",
      "additionalProperties": false,
      "required": ["useWhen", "avoidWhen"],
      "x-muxui-authoring": { "effect": "incompatible", "revisionAxes": ["content", "binding-spec"] },
      "properties": {
        "useWhen": {
          "type": "array",
          "minItems": 1,
          "items": { "type": "string", "minLength": 1 },
          "x-muxui-authoring": { "effect": "incompatible", "revisionAxes": ["content", "binding-spec"] }
        },
        "avoidWhen": {
          "type": "array",
          "items": { "type": "string", "minLength": 1 },
          "x-muxui-authoring": { "effect": "incompatible", "revisionAxes": ["content", "binding-spec"] }
        }
      }
    },
    "anatomy": {
      "type": "array",
      "minItems": 1,
      "items": { "type": "string", "pattern": "^[a-z][a-zA-Z0-9-]*$" },
      "uniqueItems": true,
      "x-muxui-authoring": {
        "effects": { "add": "compatible", "remove": "incompatible", "replace": "incompatible" },
        "revisionAxes": ["content", "binding-spec"]
      }
    },
    "states": {
      "type": "array",
      "items": { "type": "string", "pattern": "^[a-z][a-zA-Z0-9-]*$" },
      "uniqueItems": true,
      "x-muxui-authoring": {
        "effects": { "add": "compatible", "remove": "incompatible", "replace": "incompatible" },
        "revisionAxes": ["content", "binding-spec"]
      }
    },
    "accessibility": {
      "type": "object",
      "additionalProperties": false,
      "required": ["nameRequired", "obligations"],
      "x-muxui-authoring": { "effect": "incompatible", "revisionAxes": ["content", "binding-spec"] },
      "properties": {
        "nameRequired": {
          "type": "boolean",
          "x-muxui-authoring": { "effect": "incompatible", "revisionAxes": ["content", "binding-spec"] }
        },
        "obligations": {
          "type": "array",
          "items": { "type": "string", "minLength": 1 },
          "uniqueItems": true,
          "x-muxui-authoring": { "effect": "incompatible", "revisionAxes": ["content", "binding-spec"] }
        }
      }
    },
    "bindings": {
      "type": "object",
      "minProperties": 1,
      "additionalProperties": false,
      "x-muxui-authoring": {
        "effects": { "add": "compatible", "remove": "incompatible", "replace": "incompatible" },
        "revisionAxes": ["content", "binding-spec"]
      },
      "properties": {
        "web.html": {
          "$ref": "binding.schema.json",
          "x-muxui-authoring": {
            "effects": { "add": "compatible", "remove": "incompatible", "replace": "incompatible" },
            "revisionAxes": ["content", "binding-spec"]
          }
        },
        "web.react": {
          "$ref": "binding.schema.json",
          "x-muxui-authoring": {
            "effects": { "add": "compatible", "remove": "incompatible", "replace": "incompatible" },
            "revisionAxes": ["content", "binding-spec"]
          }
        },
        "native.react-native": {
          "$ref": "binding.schema.json",
          "x-muxui-authoring": {
            "effects": { "add": "compatible", "remove": "incompatible", "replace": "incompatible" },
            "revisionAxes": ["content", "binding-spec"]
          }
        }
      }
    },
    "extensions": {
      "type": "object",
      "propertyNames": { "pattern": "^muxui\\.experimental\\.[a-z0-9]+(?:-[a-z0-9]+)*$" },
      "additionalProperties": true,
      "x-muxui-authoring": {
        "effects": { "add": "compatible", "remove": "incompatible", "replace": "incompatible" },
        "revisionAxes": ["content"]
      }
    }
  }
}
