{"schemaVersion":"1.0.0","id":"muxui:component:number-field","kind":"component","name":"NumberField","summary":"Accepts a locale-aware numeric value with steppers.","lifecycle":"experimental","intent":{"useWhen":["Entering or stepping a number"],"avoidWhen":["Plain text that is not numeric"]},"anatomy":["root","label","input","decrement","increment","description","error"],"states":["idle","disabled","read-only","required","invalid"],"accessibility":{"nameRequired":true,"obligations":["Expose the numeric value and increment/decrement controls.","Expose disabled, required, and invalid states."]},"bindings":{"web.react":{"schemaVersion":"2.0.0","lifecycle":"experimental","strategy":"direct","api":{"props":["label","description","errorMessage","aria-label","aria-labelledby","value","defaultValue","disabled","readOnly","required","invalid","minValue","maxValue","step","name","formatOptions"],"events":["change"],"parts":["root","label","input","decrement","increment","description","error"],"defaults":{"disabled":false,"readOnly":false,"required":false,"invalid":false,"step":1}},"behavior":["Controlled and uncontrolled values are supported.","Keyboard input preserves the native accessible interaction model."],"accessibility":["Expose the numeric value and increment/decrement controls.","Expose disabled, required, and invalid states."],"tokenRecipe":{"source":"muxui:token:default-theme","requirements":[{"token":"semantic.field.background","requirement":"required"},{"token":"semantic.control.radius","requirement":"required"},{"token":"semantic.control.padding-inline","requirement":"required"},{"token":"semantic.focus.ring","requirement":"required"},{"token":"semantic.feedback.invalid","requirement":"required"}]},"platformSafety":[{"profile":"web.react","requirements":[{"id":"system.forced-colors","disposition":"required"},{"id":"system.high-contrast","disposition":"required"},{"id":"native.dynamic-color","disposition":"not-applicable","reason":"Native dynamic colors do not apply to the React web binding."},{"id":"native.font-metrics","disposition":"not-applicable","reason":"Native font metrics do not apply to the React web binding."},{"id":"layout.direction","disposition":"required"},{"id":"platform.accessibility-mapping","disposition":"required"}]}],"runtimeProfiles":{}}}}
