{"schemaVersion":"1.0.0","id":"muxui:component:text-field","kind":"component","name":"TextField","summary":"Accepts a single-line text value with validation.","lifecycle":"experimental","intent":{"useWhen":["Entering one line of text"],"avoidWhen":["Multiline or formatted content"]},"anatomy":["root","label","input","description","error"],"states":["idle","disabled","readonly","required","invalid"],"accessibility":{"nameRequired":true,"obligations":["Expose an accessible name, description, and validation message.","Expose disabled, required, read-only, and invalid states."]},"bindings":{"web.react":{"schemaVersion":"2.0.0","lifecycle":"experimental","strategy":"direct","api":{"props":["label","description","errorMessage","aria-label","aria-labelledby","value","defaultValue","disabled","readOnly","required","invalid","name","placeholder","type"],"events":["change"],"parts":["root","label","input","description","error"],"defaults":{"disabled":false,"readOnly":false,"required":false,"invalid":false,"type":"text"}},"behavior":["Controlled and uncontrolled values are supported.","Keyboard input preserves the native accessible interaction model."],"accessibility":["Expose an accessible name, description, and validation message.","Expose disabled, required, read-only, and invalid states."],"tokenRecipe":{"source":"muxui:token:default-theme","requirements":[{"token":"semantic.field.background","requirement":"required"},{"token":"semantic.control.radius","requirement":"required"},{"token":"semantic.control.padding-inline","requirement":"required"},{"token":"semantic.focus.ring","requirement":"required"},{"token":"semantic.feedback.invalid","requirement":"required"}]},"platformSafety":[{"profile":"web.react","requirements":[{"id":"system.forced-colors","disposition":"required"},{"id":"system.high-contrast","disposition":"required"},{"id":"native.dynamic-color","disposition":"not-applicable","reason":"Native dynamic colors do not apply to the React web binding."},{"id":"native.font-metrics","disposition":"not-applicable","reason":"Native font metrics do not apply to the React web binding."},{"id":"layout.direction","disposition":"required"},{"id":"platform.accessibility-mapping","disposition":"required"}]}],"runtimeProfiles":{}}}}
