{"schemaVersion":"1.0.0","id":"muxui:component:calendar","kind":"component","name":"Calendar","summary":"Displays and selects a single calendar date.","lifecycle":"experimental","intent":{"useWhen":["Selecting a date"],"avoidWhen":["Selecting a date range"]},"anatomy":["root","label","grid","cell"],"states":["idle","focused","disabled","read-only","invalid","selected"],"accessibility":{"nameRequired":true,"obligations":["Expose the calendar name and grid semantics.","Expose selected, disabled, and invalid dates."]},"bindings":{"web.react":{"schemaVersion":"2.0.0","lifecycle":"experimental","strategy":"direct","api":{"props":["label","aria-label","aria-labelledby","value","defaultValue","focusedValue","minValue","maxValue","disabled","readOnly","required","invalid"],"events":["change","focusChange"],"parts":["root","label","grid","cell"],"defaults":{"disabled":false,"readOnly":false,"required":false}},"behavior":["Controlled and uncontrolled ISO date values are supported.","Keyboard navigation moves through the calendar grid."],"accessibility":["Expose the calendar name and grid semantics.","Expose selected, disabled, and invalid dates."],"tokenRecipe":{"source":"muxui:token:default-theme","requirements":[{"token":"semantic.control.radius","requirement":"required"},{"token":"semantic.control.padding-inline","requirement":"required"},{"token":"semantic.focus.ring","requirement":"required"},{"token":"semantic.selection.track","requirement":"required"}]},"platformSafety":[{"profile":"web.react","requirements":[{"id":"system.forced-colors","disposition":"required"},{"id":"system.high-contrast","disposition":"required"},{"id":"native.dynamic-color","disposition":"not-applicable","reason":"Native dynamic colors do not apply to the React web binding."},{"id":"native.font-metrics","disposition":"not-applicable","reason":"Native font metrics do not apply to the React web binding."},{"id":"layout.direction","disposition":"required"},{"id":"platform.accessibility-mapping","disposition":"required"}]}],"runtimeProfiles":{}}}}
