{"schemaVersion":"1.0.0","id":"core:component:table","kind":"component","name":"Table","summary":"Displays structured data with selectable rows and columns.","lifecycle":"experimental","intent":{"useWhen":["Displaying tabular data"],"avoidWhen":["Presenting a short action list"]},"anatomy":["root","header","column","body","row","cell"],"states":["idle","focused","disabled","selected","empty"],"accessibility":{"nameRequired":true,"obligations":["Expose table, header, row, column, and cell semantics.","Expose row selection and keyboard focus."]},"bindings":{"web.react":{"schemaVersion":"2.0.0","lifecycle":"experimental","strategy":"direct","api":{"props":["aria-label","columns","rows","selectedIds","defaultSelectedIds","disabled","selectionMode"],"events":["selectionChange","rowAction"],"parts":["root","header","column","body","row","cell"],"defaults":{"disabled":false,"selectionMode":"none"}},"behavior":["Keyboard navigation moves through rows and cells.","Controlled and uncontrolled Core key selections are supported."],"accessibility":["Expose table, header, row, column, and cell semantics.","Expose row selection and keyboard focus."],"tokenRecipe":{"source":"core:token:default-theme","requirements":[{"token":"semantic.control.radius","requirement":"required"},{"token":"semantic.control.padding-inline","requirement":"required"},{"token":"semantic.focus.ring","requirement":"required"},{"token":"semantic.selection.track","requirement":"required"}]},"platformSafety":[{"profile":"web.react","requirements":[{"id":"system.forced-colors","disposition":"required"},{"id":"system.high-contrast","disposition":"required"},{"id":"native.dynamic-color","disposition":"not-applicable","reason":"Native dynamic colors do not apply to the React web binding."},{"id":"native.font-metrics","disposition":"not-applicable","reason":"Native font metrics do not apply to the React web binding."},{"id":"layout.direction","disposition":"required"},{"id":"platform.accessibility-mapping","disposition":"required"}]}],"runtimeProfiles":{}}}}
