{"schemaVersion":"1.0.0","id":"muxui:component:color-swatch-picker","kind":"component","name":"ColorSwatchPicker","summary":"Selects a color from a set of swatches.","lifecycle":"experimental","intent":{"useWhen":["Choosing a color from presets"],"avoidWhen":["Entering an arbitrary color"]},"anatomy":["root","swatch","selection"],"states":["idle","focused","disabled","selected"],"accessibility":{"nameRequired":true,"obligations":["Expose a named swatch collection.","Expose selected and disabled swatches."]},"bindings":{"web.react":{"schemaVersion":"2.0.0","lifecycle":"experimental","strategy":"direct","api":{"props":["aria-label","aria-labelledby","items","value","defaultValue","disabled"],"events":["change"],"parts":["root","swatch","selection"],"defaults":{"disabled":false}},"behavior":["Controlled and uncontrolled Core color strings are supported.","Arrow keys move through swatches."],"accessibility":["Expose a named swatch collection.","Expose selected and disabled swatches."],"tokenRecipe":{"source":"muxui:token:default-theme","requirements":[{"token":"semantic.control.radius","requirement":"required"},{"token":"semantic.control.padding-inline","requirement":"required"},{"token":"semantic.focus.ring","requirement":"required"},{"token":"semantic.selection.track","requirement":"required"}]},"platformSafety":[{"profile":"web.react","requirements":[{"id":"system.forced-colors","disposition":"required"},{"id":"system.high-contrast","disposition":"required"},{"id":"native.dynamic-color","disposition":"not-applicable","reason":"Native dynamic colors do not apply to the React web binding."},{"id":"native.font-metrics","disposition":"not-applicable","reason":"Native font metrics do not apply to the React web binding."},{"id":"layout.direction","disposition":"required"},{"id":"platform.accessibility-mapping","disposition":"required"}]}],"runtimeProfiles":{}}}}
