{"schemaVersion":"1.0.0","id":"muxui:component:color-wheel","kind":"component","name":"ColorWheel","summary":"Adjusts hue on a circular color track.","lifecycle":"experimental","intent":{"useWhen":["Choosing a hue around a wheel"],"avoidWhen":["Editing a color channel as text"]},"anatomy":["root","track","thumb"],"states":["idle","focused","disabled","read-only"],"accessibility":{"nameRequired":true,"obligations":["Expose the color wheel name and keyboard adjustment.","Expose disabled state."]},"bindings":{"web.react":{"schemaVersion":"2.0.0","lifecycle":"experimental","strategy":"direct","api":{"props":["aria-label","aria-labelledby","value","defaultValue","disabled"],"events":["change"],"parts":["root","track","thumb"],"defaults":{"disabled":false}},"behavior":["Arrow keys adjust hue.","Controlled and uncontrolled Core color strings are supported."],"accessibility":["Expose the color wheel name and keyboard adjustment.","Expose disabled state."],"tokenRecipe":{"source":"muxui:token:default-theme","requirements":[{"token":"semantic.control.radius","requirement":"required"},{"token":"semantic.focus.ring","requirement":"required"},{"token":"semantic.selection.track","requirement":"required"}]},"platformSafety":[{"profile":"web.react","requirements":[{"id":"system.forced-colors","disposition":"required"},{"id":"system.high-contrast","disposition":"required"},{"id":"native.dynamic-color","disposition":"not-applicable","reason":"Native dynamic colors do not apply to the React web binding."},{"id":"native.font-metrics","disposition":"not-applicable","reason":"Native font metrics do not apply to the React web binding."},{"id":"layout.direction","disposition":"required"},{"id":"platform.accessibility-mapping","disposition":"required"}]}],"runtimeProfiles":{}}}}
