{"schemaVersion":"1.0.0","id":"core:component:time-field","kind":"component","name":"TimeField","summary":"Accepts and edits an ISO local time.","lifecycle":"experimental","intent":{"useWhen":["Entering a local time"],"avoidWhen":["A date and time together"]},"anatomy":["root","label","input","segment","description","error"],"states":["idle","disabled","readonly","required","invalid"],"accessibility":{"nameRequired":true,"obligations":["Expose an editable local time with localized segment names.","Expose disabled, required, and invalid states."]},"bindings":{"web.react":{"schemaVersion":"2.0.0","lifecycle":"experimental","strategy":"direct","api":{"props":["label","description","errorMessage","aria-label","aria-labelledby","value","defaultValue","disabled","readOnly","required","invalid","name"],"events":["change"],"parts":["root","label","input","segment","description","error"],"defaults":{"disabled":false,"readOnly":false,"required":false,"invalid":false}},"behavior":["Controlled and uncontrolled values are supported.","Keyboard input preserves the native accessible interaction model."],"accessibility":["Expose an editable local time with localized segment names.","Expose disabled, required, and invalid states."],"tokenRecipe":{"source":"core:token:default-theme","requirements":[{"token":"semantic.field.background","requirement":"required"},{"token":"semantic.control.radius","requirement":"required"},{"token":"semantic.control.padding-inline","requirement":"required"},{"token":"semantic.focus.ring","requirement":"required"},{"token":"semantic.feedback.invalid","requirement":"required"}]},"platformSafety":[{"profile":"web.react","requirements":[{"id":"system.forced-colors","disposition":"required"},{"id":"system.high-contrast","disposition":"required"},{"id":"native.dynamic-color","disposition":"not-applicable","reason":"Native dynamic colors do not apply to the React web binding."},{"id":"native.font-metrics","disposition":"not-applicable","reason":"Native font metrics do not apply to the React web binding."},{"id":"layout.direction","disposition":"required"},{"id":"platform.accessibility-mapping","disposition":"required"}]}],"runtimeProfiles":{}}}}
