{"schemaVersion":"1.0.0","id":"core:component:color-picker","kind":"component","name":"ColorPicker","summary":"Composes coordinated color controls.","lifecycle":"experimental","intent":{"useWhen":["Combining color controls"],"avoidWhen":["Rendering a single color swatch"]},"anatomy":["root","field","area","slider","swatch"],"states":["idle","focused","disabled","read-only"],"accessibility":{"nameRequired":false,"obligations":["Share one color value with composed color controls.","Preserve accessible names for each child control."]},"bindings":{"web.react":{"schemaVersion":"2.0.0","lifecycle":"experimental","strategy":"direct","api":{"props":["value","defaultValue","disabled","readOnly"],"events":["change"],"parts":["root","field","area","slider","swatch"],"defaults":{"disabled":false,"readOnly":false}},"behavior":["Controlled and uncontrolled Core color strings are shared with children."],"accessibility":["Share one color value with composed color controls.","Preserve accessible names for each child control."],"tokenRecipe":{"source":"core:token:default-theme","requirements":[{"token":"semantic.control.radius","requirement":"required"},{"token":"semantic.control.padding-inline","requirement":"required"},{"token":"semantic.focus.ring","requirement":"required"},{"token":"semantic.overlay.background","requirement":"required"}]},"platformSafety":[{"profile":"web.react","requirements":[{"id":"system.forced-colors","disposition":"required"},{"id":"system.high-contrast","disposition":"required"},{"id":"native.dynamic-color","disposition":"not-applicable","reason":"Native dynamic colors do not apply to the React web binding."},{"id":"native.font-metrics","disposition":"not-applicable","reason":"Native font metrics do not apply to the React web binding."},{"id":"layout.direction","disposition":"required"},{"id":"platform.accessibility-mapping","disposition":"required"}]}],"runtimeProfiles":{}}}}
