{"schemaVersion":"1.0.0","id":"muxui:component:range-calendar","kind":"component","name":"RangeCalendar","summary":"Displays and selects a date range.","lifecycle":"experimental","intent":{"useWhen":["Selecting a start and end date"],"avoidWhen":["Selecting one date"]},"anatomy":["root","label","grid","cell"],"states":["idle","focused","disabled","read-only","invalid","selected"],"accessibility":{"nameRequired":true,"obligations":["Expose range calendar and grid semantics.","Expose range start, end, disabled, and invalid dates."]},"bindings":{"web.react":{"schemaVersion":"2.0.0","lifecycle":"experimental","strategy":"direct","api":{"props":["label","aria-label","aria-labelledby","value","defaultValue","minValue","maxValue","disabled","readOnly","required","invalid"],"events":["change"],"parts":["root","label","grid","cell"],"defaults":{"disabled":false,"readOnly":false,"required":false}},"behavior":["Controlled and uncontrolled Core ISO range values are supported.","Keyboard navigation selects a start and end date."],"accessibility":["Expose range calendar and grid semantics.","Expose range start, end, disabled, and invalid dates."],"tokenRecipe":{"source":"muxui:token:default-theme","requirements":[{"token":"semantic.control.radius","requirement":"required"},{"token":"semantic.control.padding-inline","requirement":"required"},{"token":"semantic.focus.ring","requirement":"required"},{"token":"semantic.selection.track","requirement":"required"}]},"platformSafety":[{"profile":"web.react","requirements":[{"id":"system.forced-colors","disposition":"required"},{"id":"system.high-contrast","disposition":"required"},{"id":"native.dynamic-color","disposition":"not-applicable","reason":"Native dynamic colors do not apply to the React web binding."},{"id":"native.font-metrics","disposition":"not-applicable","reason":"Native font metrics do not apply to the React web binding."},{"id":"layout.direction","disposition":"required"},{"id":"platform.accessibility-mapping","disposition":"required"}]}],"runtimeProfiles":{}}}}
