{"schemaVersion":"1.0.0","id":"core:component:radio-group","kind":"component","name":"RadioGroup","summary":"Selects one option from a named group.","lifecycle":"experimental","intent":{"useWhen":["Choosing one option"],"avoidWhen":["Choosing multiple options"]},"anatomy":["root","label","radio"],"states":["idle","focused","disabled","read-only","invalid","selected"],"accessibility":{"nameRequired":true,"obligations":["Expose the group name and radio relationships.","Expose selected, disabled, and invalid state."]},"bindings":{"web.react":{"schemaVersion":"2.0.0","lifecycle":"experimental","strategy":"direct","api":{"props":["label","aria-label","aria-labelledby","options","value","defaultValue","disabled","readOnly","required","invalid"],"events":["change"],"parts":["root","label","radio"],"defaults":{"disabled":false,"readOnly":false,"required":false,"invalid":false}},"behavior":["Arrow keys move between radios.","Controlled and uncontrolled Core string values are supported."],"accessibility":["Expose the group name and radio relationships.","Expose selected, disabled, and invalid state."],"tokenRecipe":{"source":"core:token:default-theme","requirements":[{"token":"semantic.control.radius","requirement":"required"},{"token":"semantic.control.padding-inline","requirement":"required"},{"token":"semantic.focus.ring","requirement":"required"},{"token":"semantic.selection.track","requirement":"required"}]},"platformSafety":[{"profile":"web.react","requirements":[{"id":"system.forced-colors","disposition":"required"},{"id":"system.high-contrast","disposition":"required"},{"id":"native.dynamic-color","disposition":"not-applicable","reason":"Native dynamic colors do not apply to the React web binding."},{"id":"native.font-metrics","disposition":"not-applicable","reason":"Native font metrics do not apply to the React web binding."},{"id":"layout.direction","disposition":"required"},{"id":"platform.accessibility-mapping","disposition":"required"}]}],"runtimeProfiles":{}}}}
