{"schemaVersion":"1.0.0","id":"muxui:component:form","kind":"component","name":"Form","summary":"Provides submission and reset semantics for related fields.","lifecycle":"experimental","intent":{"useWhen":["Submitting a group of fields"],"avoidWhen":["A layout-only group"]},"anatomy":["root","content"],"states":["idle","submitting","invalid"],"accessibility":{"nameRequired":false,"obligations":["Associate descendant controls and preserve submit/reset semantics."]},"bindings":{"web.react":{"schemaVersion":"2.0.0","lifecycle":"experimental","strategy":"direct","api":{"props":["validationBehavior","method","action","onSubmit","onReset"],"events":["submit","reset"],"parts":["root","content"],"defaults":{"validationBehavior":"native","method":"get"}},"behavior":["Descendant controls submit and reset through the form owner."],"accessibility":["Associate descendant controls and preserve submit/reset semantics."],"tokenRecipe":{"source":"muxui:token:default-theme","requirements":[{"token":"semantic.control.padding-inline","requirement":"required"},{"token":"semantic.control.radius","requirement":"required"}]},"platformSafety":[{"profile":"web.react","requirements":[{"id":"system.forced-colors","disposition":"required"},{"id":"system.high-contrast","disposition":"required"},{"id":"native.dynamic-color","disposition":"not-applicable","reason":"Native dynamic colors do not apply to the React web binding."},{"id":"native.font-metrics","disposition":"not-applicable","reason":"Native font metrics do not apply to the React web binding."},{"id":"layout.direction","disposition":"required"},{"id":"platform.accessibility-mapping","disposition":"required"}]}],"runtimeProfiles":{}}}}
