{"schemaVersion":"1.0.0","id":"muxui:component:slider","kind":"component","name":"Slider","summary":"Adjusts a numeric value along a track.","lifecycle":"experimental","intent":{"useWhen":["Choosing a numeric value"],"avoidWhen":["Entering a precise value in a field"]},"anatomy":["root","label","track","thumb"],"states":["idle","focused","disabled","read-only","selected"],"accessibility":{"nameRequired":true,"obligations":["Expose the slider name, range, and current value.","Expose disabled state and keyboard adjustment."]},"bindings":{"web.react":{"schemaVersion":"2.0.0","lifecycle":"experimental","strategy":"direct","api":{"props":["label","aria-label","aria-labelledby","value","defaultValue","min","max","step","disabled","orientation"],"events":["change"],"parts":["root","label","track","thumb"],"defaults":{"min":0,"max":100,"step":1,"disabled":false,"orientation":"horizontal"}},"behavior":["Arrow keys adjust the value by step.","Controlled and uncontrolled numeric values are supported."],"accessibility":["Expose the slider name, range, and current value.","Expose disabled state and keyboard adjustment."],"tokenRecipe":{"source":"muxui:token:default-theme","requirements":[{"token":"semantic.control.radius","requirement":"required"},{"token":"semantic.control.padding-inline","requirement":"required"},{"token":"semantic.focus.ring","requirement":"required"},{"token":"semantic.selection.track","requirement":"required"}]},"platformSafety":[{"profile":"web.react","requirements":[{"id":"system.forced-colors","disposition":"required"},{"id":"system.high-contrast","disposition":"required"},{"id":"native.dynamic-color","disposition":"not-applicable","reason":"Native dynamic colors do not apply to the React web binding."},{"id":"native.font-metrics","disposition":"not-applicable","reason":"Native font metrics do not apply to the React web binding."},{"id":"layout.direction","disposition":"required"},{"id":"platform.accessibility-mapping","disposition":"required"}]}],"runtimeProfiles":{}}}}
