{
  "schemaVersion": "1.0.0",
  "id": "core:component:link",
  "kind": "component",
  "name": "Link",
  "summary": "Navigates to another location or resource.",
  "lifecycle": "experimental",
  "intent": {
    "useWhen": [
      "Navigating to another location"
    ],
    "avoidWhen": [
      "Triggering an immediate action"
    ]
  },
  "anatomy": [
    "root",
    "label"
  ],
  "states": [
    "idle",
    "current",
    "disabled",
    "pressed"
  ],
  "accessibility": {
    "nameRequired": true,
    "obligations": [
      "Expose link semantics and destination",
      "Expose current and disabled states"
    ]
  },
  "bindings": {
    "web.html": {
      "schemaVersion": "2.0.0",
      "lifecycle": "experimental",
      "strategy": "direct",
      "api": {
        "props": [
          "href",
          "disabled",
          "current",
          "target",
          "rel"
        ],
        "events": [
          "activate"
        ],
        "parts": [
          "root",
          "label"
        ],
        "defaults": {
          "disabled": false,
          "current": false
        }
      },
      "behavior": [
        "Enter activates an enabled link",
        "Disabled links suppress navigation and remain perceivable"
      ],
      "accessibility": [
        "Expose link role, destination, current state, and disabled state"
      ],
      "tokenRecipe": {
        "source": "core:token:default-theme",
        "requirements": [
          {
            "token": "semantic.focus.ring",
            "requirement": "required"
          },
          {
            "token": "semantic.motion.feedback",
            "requirement": "required"
          }
        ]
      },
      "platformSafety": [
        {
          "profile": "web.html",
          "requirements": [
            {
              "id": "system.forced-colors",
              "disposition": "required"
            },
            {
              "id": "system.high-contrast",
              "disposition": "required"
            },
            {
              "id": "native.dynamic-color",
              "disposition": "not-applicable",
              "reason": "Native dynamic colors do not apply to web.html."
            },
            {
              "id": "native.font-metrics",
              "disposition": "not-applicable",
              "reason": "Native font metrics do not apply to web.html."
            },
            {
              "id": "layout.direction",
              "disposition": "required"
            },
            {
              "id": "platform.accessibility-mapping",
              "disposition": "required"
            }
          ]
        }
      ],
      "runtimeProfiles": {}
    },
    "web.react": {
      "schemaVersion": "2.0.0",
      "lifecycle": "experimental",
      "strategy": "direct",
      "api": {
        "props": [
          "href",
          "disabled",
          "current",
          "target",
          "rel"
        ],
        "events": [
          "activate"
        ],
        "parts": [
          "root",
          "label"
        ],
        "defaults": {
          "disabled": false,
          "current": false
        }
      },
      "behavior": [
        "Enter activates an enabled link",
        "Disabled links suppress navigation and remain perceivable"
      ],
      "accessibility": [
        "Expose link role, destination, current state, and disabled state"
      ],
      "tokenRecipe": {
        "source": "core:token:default-theme",
        "requirements": [
          {
            "token": "semantic.focus.ring",
            "requirement": "required"
          },
          {
            "token": "semantic.motion.feedback",
            "requirement": "required"
          }
        ]
      },
      "platformSafety": [
        {
          "profile": "web.react",
          "requirements": [
            {
              "id": "system.forced-colors",
              "disposition": "required"
            },
            {
              "id": "system.high-contrast",
              "disposition": "required"
            },
            {
              "id": "native.dynamic-color",
              "disposition": "not-applicable",
              "reason": "Native dynamic colors do not apply to web.react."
            },
            {
              "id": "native.font-metrics",
              "disposition": "not-applicable",
              "reason": "Native font metrics do not apply to web.react."
            },
            {
              "id": "layout.direction",
              "disposition": "required"
            },
            {
              "id": "platform.accessibility-mapping",
              "disposition": "required"
            }
          ]
        }
      ],
      "runtimeProfiles": {}
    }
  }
}
