{"schemaVersion":"1.0.0","id":"muxui:component:date-range-picker","kind":"component","name":"DateRangePicker","summary":"Combines two ISO date fields with a range calendar chooser.","lifecycle":"experimental","intent":{"useWhen":["Choosing a contiguous date range"],"avoidWhen":["A single date"]},"anatomy":["root","label","start","end","trigger","calendar","description","error"],"states":["idle","open","disabled","read-only","required","invalid"],"accessibility":{"nameRequired":true,"obligations":["Expose start and end dates and the calendar trigger.","Keep the range calendar and focused dates keyboard accessible."]},"bindings":{"web.react":{"schemaVersion":"2.0.0","lifecycle":"experimental","strategy":"direct","api":{"props":["label","description","errorMessage","aria-label","aria-labelledby","value","defaultValue","minValue","maxValue","unavailableDateMatcher","open","defaultOpen","disabled","readOnly","required","invalid","startName","endName"],"events":["change","openChange"],"parts":["root","label","start","end","trigger","calendar","description","error"],"defaults":{"disabled":false,"readOnly":false,"required":false,"invalid":false,"defaultOpen":false}},"behavior":["Controlled and uncontrolled values are supported.","Keyboard input preserves the native accessible interaction model.","Min/max date bounds are inclusive; controlled and default out-of-range values remain visible and invalid.","Range unavailable callbacks receive serialized date and nullable anchor strings while preserving contiguous range selection.","Open state is independently controlled with open/defaultOpen and onOpenChange; defaultOpen is false.","Built-in invalid presentation follows the owning Form validationBehavior; name-keyed external errors are exposed immediately."],"accessibility":["Expose start and end dates and the calendar trigger.","Keep the range calendar and focused dates keyboard accessible."],"tokenRecipe":{"source":"muxui:token:default-theme","requirements":[{"token":"semantic.field.background","requirement":"required"},{"token":"semantic.control.radius","requirement":"required"},{"token":"semantic.control.padding-inline","requirement":"required"},{"token":"semantic.focus.ring","requirement":"required"},{"token":"semantic.feedback.invalid","requirement":"required"}]},"platformSafety":[{"profile":"web.react","requirements":[{"id":"system.forced-colors","disposition":"required"},{"id":"system.high-contrast","disposition":"required"},{"id":"native.dynamic-color","disposition":"not-applicable","reason":"Native dynamic colors do not apply to the React web binding."},{"id":"native.font-metrics","disposition":"not-applicable","reason":"Native font metrics do not apply to the React web binding."},{"id":"layout.direction","disposition":"required"},{"id":"platform.accessibility-mapping","disposition":"required"}]}],"runtimeProfiles":{}}}}
