{"schemaVersion":"1.0.0","id":"muxui:component:color-area","kind":"component","name":"ColorArea","summary":"Adjusts two channels of a color in a two-dimensional area.","lifecycle":"experimental","intent":{"useWhen":["Selecting saturation and brightness"],"avoidWhen":["Editing a textual color value"]},"anatomy":["root","area","thumb"],"states":["idle","focused","disabled","read-only"],"accessibility":{"nameRequired":true,"obligations":["Expose the color area name and two-dimensional keyboard adjustments.","Expose disabled state."]},"bindings":{"web.react":{"schemaVersion":"2.0.0","lifecycle":"experimental","strategy":"direct","api":{"props":["label","aria-label","aria-labelledby","value","defaultValue","disabled","readOnly"],"events":["change"],"parts":["root","area","thumb"],"defaults":{"disabled":false,"readOnly":false}},"behavior":["Controlled and uncontrolled Core color strings are supported.","Arrow keys adjust the active color channels."],"accessibility":["Expose the color area name and two-dimensional keyboard adjustments.","Expose disabled state."],"tokenRecipe":{"source":"muxui:token:default-theme","requirements":[{"token":"semantic.control.radius","requirement":"required"},{"token":"semantic.control.padding-inline","requirement":"required"},{"token":"semantic.focus.ring","requirement":"required"},{"token":"semantic.selection.track","requirement":"required"}]},"platformSafety":[{"profile":"web.react","requirements":[{"id":"system.forced-colors","disposition":"required"},{"id":"system.high-contrast","disposition":"required"},{"id":"native.dynamic-color","disposition":"not-applicable","reason":"Native dynamic colors do not apply to the React web binding."},{"id":"native.font-metrics","disposition":"not-applicable","reason":"Native font metrics do not apply to the React web binding."},{"id":"layout.direction","disposition":"required"},{"id":"platform.accessibility-mapping","disposition":"required"}]}],"runtimeProfiles":{}}}}
